{
  "pairingVersion": 3,
  "mode": "Persistent",
  "hostId": "example-host",
  "pipeName": "Ventana.Extensions.v3.example-host.store.a8c06b3027d3fc4a.00112233445566778899aabbccddeeff",
  "registrationId": "00112233445566778899aabbccddeeff",
  "extensionId": "example.countdown",
  "secret": "\/\/\/\/\/\/\/\/\/\/\/\/\/\/\/\/\/\/\/\/\/\/\/\/\/\/\/\/\/\/\/\/\/\/\/\/\/\/\/\/\/\/8="
}
